name,image,year,runTime,genre,rating,director,stars,description
In Bruges,https://firebasestorage.googleapis.com:443/v0/b/movie-mate-4ef5c.firebasestorage.app/o/movieImage%2F8187A149-90E0-4306-9C8A-560777703339.jpg?alt=media&token=b2688aad-e288-4838-b694-e55c6f683bbb,2008,107 min,"Comedy, Crime, Drama",7.9,Martin McDonagh,Colin Farrell Brendan Gleeson Ciarán Hinds Elizabeth Berrington,"Guilt-stricken after a job gone wrong, hitman Ray and his partner await orders from their ruthless boss in Bruges, Belgium, the last place in the world Ray wants to be."
The Man from Earth,https://firebasestorage.googleapis.com:443/v0/b/movie-mate-4ef5c.firebasestorage.app/o/movieImage%2F8187A149-90E0-4306-9C8A-560777703339.jpg?alt=media&token=b2688aad-e288-4838-b694-e55c6f683bbb,2007,87 min,"Drama, Fantasy, Mystery",7.9,Richard Schenkman,David Lee Smith Tony Todd John Billingsley Ellen Crawford,An impromptu goodbye party for Professor John Oldman becomes a mysterious interrogation after the retiring scholar reveals to his colleagues he has a longer and stranger past than they can imagine.
Letters from Iwo Jima,https://firebasestorage.googleapis.com:443/v0/b/movie-mate-4ef5c.firebasestorage.app/o/movieImage%2F8187A149-90E0-4306-9C8A-560777703339.jpg?alt=media&token=b2688aad-e288-4838-b694-e55c6f683bbb,2006,141 min,"Action, Adventure, Drama",7.9,Clint Eastwood,Ken Watanabe Kazunari Ninomiya Tsuyoshi Ihara Ryô Kase,"The story of the battle of Iwo Jima between the United States and Imperial Japan during World War II, as told from the perspective of the Japanese who fought it."
The Fall,https://firebasestorage.googleapis.com:443/v0/b/movie-mate-4ef5c.firebasestorage.app/o/movieImage%2F8187A149-90E0-4306-9C8A-560777703339.jpg?alt=media&token=b2688aad-e288-4838-b694-e55c6f683bbb,2006,117 min,"Adventure, Drama, Fantasy",7.9,Tarsem Singh,Lee Pace Catinca Untaru Justine Waddell Kim Uylenbroek,"In a hospital on the outskirts of 1920s Los Angeles, an injured stuntman begins to tell a fellow patient, a little girl with a broken arm, a fantastic story of five mythical heroes. Thanks to his fractured state of mind and her vivid imagination, the line between fiction and reality blurs as the tale advances."
Life of Pi,https://firebasestorage.googleapis.com:443/v0/b/movie-mate-4ef5c.firebasestorage.app/o/movieImage%2F8187A149-90E0-4306-9C8A-560777703339.jpg?alt=media&token=b2688aad-e288-4838-b694-e55c6f683bbb,2012,127 min,"Adventure, Drama, Fantasy",7.9,Ang Lee,Suraj Sharma Irrfan Khan Adil Hussain Tabu,"A young man who survives a disaster at sea is hurtled into an epic journey of adventure and discovery. While cast away, he forms an unexpected connection with another survivor: a fearsome Bengal tiger."
Fantastic Mr. Fox,https://firebasestorage.googleapis.com:443/v0/b/movie-mate-4ef5c.firebasestorage.app/o/movieImage%2F8187A149-90E0-4306-9C8A-560777703339.jpg?alt=media&token=b2688aad-e288-4838-b694-e55c6f683bbb,2009,87 min,"Animation, Adventure, Comedy",7.9,Wes Anderson,George Clooney Meryl Streep Bill Murray Jason Schwartzman,An urbane fox cannot resist returning to his farm raiding ways and then must help his community survive the farmers' retaliation.
C.R.A.Z.Y.,https://firebasestorage.googleapis.com:443/v0/b/movie-mate-4ef5c.firebasestorage.app/o/movieImage%2F8187A149-90E0-4306-9C8A-560777703339.jpg?alt=media&token=b2688aad-e288-4838-b694-e55c6f683bbb,2005,129 min,"Comedy, Drama",7.9,Jean-Marc Vallée,Michel Côté Marc-André Grondin Danielle Proulx Émile Vallée,"A young French-Canadian, growing up in the 1960s and 1970s, struggles to reconcile his emerging homosexuality with his father's conservative values and his own Catholic beliefs."
Les choristes,https://firebasestorage.googleapis.com:443/v0/b/movie-mate-4ef5c.firebasestorage.app/o/movieImage%2F8187A149-90E0-4306-9C8A-560777703339.jpg?alt=media&token=b2688aad-e288-4838-b694-e55c6f683bbb,2004,97 min,"Drama, Music",7.9,Christophe Barratier,Gérard Jugnot François Berléand Jean-Baptiste Maunier Kad Merad,The new teacher at a severely administered boys' boarding school works to positively affect the students' lives through music.
Iron Man,https://firebasestorage.googleapis.com:443/v0/b/movie-mate-4ef5c.firebasestorage.app/o/movieImage%2F8187A149-90E0-4306-9C8A-560777703339.jpg?alt=media&token=b2688aad-e288-4838-b694-e55c6f683bbb,2008,126 min,"Action, Adventure, Sci-Fi",7.9,Jon Favreau,Robert Downey Jr. Gwyneth Paltrow Terrence Howard Jeff Bridges,"After being held captive in an Afghan cave, billionaire engineer Tony Stark creates a unique weaponized suit of armor to fight evil."
Shaun of the Dead,https://firebasestorage.googleapis.com:443/v0/b/movie-mate-4ef5c.firebasestorage.app/o/movieImage%2F8187A149-90E0-4306-9C8A-560777703339.jpg?alt=media&token=b2688aad-e288-4838-b694-e55c6f683bbb,2004,99 min,"Comedy, Horror",7.9,Edgar Wright,Simon Pegg Nick Frost Kate Ashfield Lucy Davis,A man's uneventful life is disrupted by the zombie apocalypse.
Gegen die Wand,https://firebasestorage.googleapis.com:443/v0/b/movie-mate-4ef5c.firebasestorage.app/o/movieImage%2F8187A149-90E0-4306-9C8A-560777703339.jpg?alt=media&token=b2688aad-e288-4838-b694-e55c6f683bbb,2004,121 min,"Drama, Romance",7.9,Fatih Akin,Birol Ünel Sibel Kekilli Güven Kiraç Zarah Jane McKenzie,"With the intention to break free from the strict familial restrictions, a suicidal young woman sets up a marriage of convenience with a forty-year-old addict, an act that will lead to an outburst of envious love."
Mystic River,https://firebasestorage.googleapis.com:443/v0/b/movie-mate-4ef5c.firebasestorage.app/o/movieImage%2F8187A149-90E0-4306-9C8A-560777703339.jpg?alt=media&token=b2688aad-e288-4838-b694-e55c6f683bbb,2003,138 min,"Crime, Drama, Mystery",7.9,Clint Eastwood,Sean Penn Tim Robbins Kevin Bacon Emmy Rossum,The lives of three men who were childhood friends are shattered when one of them has a family tragedy.
Harry Potter and the Prisoner of Azkaban,https://firebasestorage.googleapis.com:443/v0/b/movie-mate-4ef5c.firebasestorage.app/o/movieImage%2F8187A149-90E0-4306-9C8A-560777703339.jpg?alt=media&token=b2688aad-e288-4838-b694-e55c6f683bbb,2004,142 min,"Adventure, Family, Fantasy",7.9,Alfonso Cuarón,Daniel Radcliffe Emma Watson Rupert Grint Richard Griffiths,"Harry Potter, Ron and Hermione return to Hogwarts School of Witchcraft and Wizardry for their third year of study, where they delve into the mystery surrounding an escaped prisoner who poses a dangerous threat to the young wizard."
Ying xiong,https://firebasestorage.googleapis.com:443/v0/b/movie-mate-4ef5c.firebasestorage.app/o/movieImage%2F8187A149-90E0-4306-9C8A-560777703339.jpg?alt=media&token=b2688aad-e288-4838-b694-e55c6f683bbb,2002,120 min,"Action, Adventure, History",7.9,Yimou Zhang,Jet Li Tony Chiu-Wai Leung Maggie Cheung Ziyi Zhang,"A defense officer, Nameless, was summoned by the King of Qin regarding his success of terminating three warriors."
Hable con ella,https://firebasestorage.googleapis.com:443/v0/b/movie-mate-4ef5c.firebasestorage.app/o/movieImage%2F8187A149-90E0-4306-9C8A-560777703339.jpg?alt=media&token=b2688aad-e288-4838-b694-e55c6f683bbb,2002,112 min,"Drama, Mystery, Romance",7.9,Pedro Almodóvar,Rosario Flores Javier Cámara Darío Grandinetti Leonor Watling,Two men share an odd friendship while they care for two women who are both in deep comas.
No Man's Land,https://firebasestorage.googleapis.com:443/v0/b/movie-mate-4ef5c.firebasestorage.app/o/movieImage%2F8187A149-90E0-4306-9C8A-560777703339.jpg?alt=media&token=b2688aad-e288-4838-b694-e55c6f683bbb,2001,98 min,"Comedy, Drama, War",7.9,Danis Tanovic,Branko Djuric Rene Bitorajac Filip Sovagovic Georges Siatidis,"Bosnia and Herzegovina during 1993 at the time of the heaviest fighting between the two warring sides. Two soldiers from opposing sides in the conflict, Nino and Ciki, become trapped in no man's land, whilst a third soldier becomes a living booby trap."
Cowboy Bebop: Tengoku no tobira,https://firebasestorage.googleapis.com:443/v0/b/movie-mate-4ef5c.firebasestorage.app/o/movieImage%2F8187A149-90E0-4306-9C8A-560777703339.jpg?alt=media&token=b2688aad-e288-4838-b694-e55c6f683bbb,2001,115 min,"Animation, Action, Crime",7.9,Shin'ichirô Watanabe,Tensai Okamura Hiroyuki Okiura Yoshiyuki Takei Beau Billingslea,"A terrorist explosion releases a deadly virus on the masses, and it's up the bounty-hunting Bebop crew to catch the cold-blooded culprit."
The Bourne Identity,https://firebasestorage.googleapis.com:443/v0/b/movie-mate-4ef5c.firebasestorage.app/o/movieImage%2F8187A149-90E0-4306-9C8A-560777703339.jpg?alt=media&token=b2688aad-e288-4838-b694-e55c6f683bbb,2002,119 min,"Action, Mystery, Thriller",7.9,Doug Liman,Franka Potente Matt Damon Chris Cooper Clive Owen,"A man is picked up by a fishing boat, bullet-riddled and suffering from amnesia, before racing to elude assassins and attempting to regain his memory."
Nueve reinas,https://firebasestorage.googleapis.com:443/v0/b/movie-mate-4ef5c.firebasestorage.app/o/movieImage%2F8187A149-90E0-4306-9C8A-560777703339.jpg?alt=media&token=b2688aad-e288-4838-b694-e55c6f683bbb,2000,114 min,"Crime, Drama, Thriller",7.9,Fabián Bielinsky,Ricardo Darín Gastón Pauls Graciela Tenenbaum María Mercedes Villagra,"Two con artists try to swindle a stamp collector by selling him a sheet of counterfeit rare stamps (the ""nine queens"")."
Children of Men,https://firebasestorage.googleapis.com:443/v0/b/movie-mate-4ef5c.firebasestorage.app/o/movieImage%2F8187A149-90E0-4306-9C8A-560777703339.jpg?alt=media&token=b2688aad-e288-4838-b694-e55c6f683bbb,2006,109 min,"Adventure, Drama, Sci-Fi",7.9,Alfonso Cuarón,Julianne Moore Clive Owen Chiwetel Ejiofor Michael Caine,"In 2027, in a chaotic world in which women have become somehow infertile, a former activist agrees to help transport a miraculously pregnant woman to a sanctuary at sea."
Almost Famous,https://firebasestorage.googleapis.com:443/v0/b/movie-mate-4ef5c.firebasestorage.app/o/movieImage%2F8187A149-90E0-4306-9C8A-560777703339.jpg?alt=media&token=b2688aad-e288-4838-b694-e55c6f683bbb,2000,122 min,"Adventure, Comedy, Drama",7.9,Cameron Crowe,Billy Crudup Patrick Fugit Kate Hudson Frances McDormand,A high-school boy is given the chance to write a story for Rolling Stone Magazine about an up-and-coming rock band as he accompanies them on their concert tour.
Mulholland Dr.,https://firebasestorage.googleapis.com:443/v0/b/movie-mate-4ef5c.firebasestorage.app/o/movieImage%2F8187A149-90E0-4306-9C8A-560777703339.jpg?alt=media&token=b2688aad-e288-4838-b694-e55c6f683bbb,2001,147 min,"Drama, Mystery, Thriller",7.9,David Lynch,Naomi Watts Laura Harring Justin Theroux Jeanne Bates,"After a car wreck on the winding Mulholland Drive renders a woman amnesiac, she and a perky Hollywood-hopeful search for clues and answers across Los Angeles in a twisting venture beyond dreams and reality."
Toy Story 2,https://firebasestorage.googleapis.com:443/v0/b/movie-mate-4ef5c.firebasestorage.app/o/movieImage%2F8187A149-90E0-4306-9C8A-560777703339.jpg?alt=media&token=b2688aad-e288-4838-b694-e55c6f683bbb,1999,92 min,"Animation, Adventure, Comedy",7.9,John Lasseter,Ash Brannon Lee Unkrich Tom Hanks Tim Allen,"When Woody is stolen by a toy collector, Buzz and his friends set out on a rescue mission to save Woody before he becomes a museum toy property with his roundup gang Jessie, Prospector, and Bullseye."
Boogie Nights,https://firebasestorage.googleapis.com:443/v0/b/movie-mate-4ef5c.firebasestorage.app/o/movieImage%2F8187A149-90E0-4306-9C8A-560777703339.jpg?alt=media&token=b2688aad-e288-4838-b694-e55c6f683bbb,1997,155 min,Drama,7.9,Paul Thomas Anderson,Mark Wahlberg Julianne Moore Burt Reynolds Luis Guzmán,"Back when sex was safe, pleasure was a business and business was booming, an idealistic porn producer aspires to elevate his craft to an art when he discovers a hot young talent."
Mimi wo sumaseba,https://firebasestorage.googleapis.com:443/v0/b/movie-mate-4ef5c.firebasestorage.app/o/movieImage%2F8187A149-90E0-4306-9C8A-560777703339.jpg?alt=media&token=b2688aad-e288-4838-b694-e55c6f683bbb,1995,111 min,"Animation, Drama, Family",7.9,Yoshifumi Kondô,Yoko Honna Issey Takahashi Takashi Tachibana Shigeru Muroi,"A love story between a girl who loves reading books, and a boy who has previously checked out all of the library books she chooses."
Once Were Warriors,https://firebasestorage.googleapis.com:443/v0/b/movie-mate-4ef5c.firebasestorage.app/o/movieImage%2F8187A149-90E0-4306-9C8A-560777703339.jpg?alt=media&token=b2688aad-e288-4838-b694-e55c6f683bbb,1994,102 min,"Crime, Drama",7.9,Lee Tamahori,Rena Owen Temuera Morrison Mamaengaroa Kerr-Bell Julian Arahanga,A family descended from Maori warriors is bedeviled by a violent father and the societal problems of being treated as outcasts.
True Romance,https://firebasestorage.googleapis.com:443/v0/b/movie-mate-4ef5c.firebasestorage.app/o/movieImage%2F8187A149-90E0-4306-9C8A-560777703339.jpg?alt=media&token=b2688aad-e288-4838-b694-e55c6f683bbb,1993,119 min,"Crime, Drama, Romance",7.9,Tony Scott,Christian Slater Patricia Arquette Dennis Hopper Val Kilmer,"In Detroit, a lonely pop culture geek marries a call girl, steals cocaine from her pimp, and tries to sell it in Hollywood. Meanwhile, the owners of the cocaine, the Mob, track them down in an attempt to reclaim it."
Trois couleurs: Bleu,https://firebasestorage.googleapis.com:443/v0/b/movie-mate-4ef5c.firebasestorage.app/o/movieImage%2F8187A149-90E0-4306-9C8A-560777703339.jpg?alt=media&token=b2688aad-e288-4838-b694-e55c6f683bbb,1993,94 min,"Drama, Music, Mystery",7.9,Krzysztof Kieslowski,Juliette Binoche Zbigniew Zamachowski Julie Delpy Benoît Régent,A woman struggles to find a way to live her life after the death of her husband and child.
Jûbê ninpûchô,https://firebasestorage.googleapis.com:443/v0/b/movie-mate-4ef5c.firebasestorage.app/o/movieImage%2F8187A149-90E0-4306-9C8A-560777703339.jpg?alt=media&token=b2688aad-e288-4838-b694-e55c6f683bbb,1993,94 min,"Animation, Action, Adventure",7.9,Yoshiaki Kawajiri,Kôichi Yamadera Emi Shinohara Takeshi Aono Osamu Saka,A vagabond swordsman is aided by a beautiful ninja girl and a crafty spy in confronting a demonic clan of killers - with a ghost from his past as their leader - who are bent on overthrowing the Tokugawa Shogunate.
Carlito's Way,https://firebasestorage.googleapis.com:443/v0/b/movie-mate-4ef5c.firebasestorage.app/o/movieImage%2F8187A149-90E0-4306-9C8A-560777703339.jpg?alt=media&token=b2688aad-e288-4838-b694-e55c6f683bbb,1993,144 min,"Crime, Drama, Thriller",7.9,Brian De Palma,Al Pacino Sean Penn Penelope Ann Miller John Leguizamo,"A Puerto Rican former convict, just released from prison, pledges to stay away from drugs and violence despite the pressure around him and lead on to a better life outside of N.Y.C."
Edward Scissorhands,https://firebasestorage.googleapis.com:443/v0/b/movie-mate-4ef5c.firebasestorage.app/o/movieImage%2F8187A149-90E0-4306-9C8A-560777703339.jpg?alt=media&token=b2688aad-e288-4838-b694-e55c6f683bbb,1990,105 min,"Drama, Fantasy, Romance",7.9,Tim Burton,Johnny Depp Winona Ryder Dianne Wiest Anthony Michael Hall,"An artificial man, who was incompletely constructed and has scissors for hands, leads a solitary life. Then one day, a suburban lady meets him and introduces him to her world."
My Left Foot: The Story of Christy Brown,https://firebasestorage.googleapis.com:443/v0/b/movie-mate-4ef5c.firebasestorage.app/o/movieImage%2F8187A149-90E0-4306-9C8A-560777703339.jpg?alt=media&token=b2688aad-e288-4838-b694-e55c6f683bbb,1989,103 min,"Biography, Drama",7.9,Jim Sheridan,Daniel Day-Lewis Brenda Fricker Alison Whelan Kirsten Sheridan,"Christy Brown, born with cerebral palsy, learns to paint and write with his only controllable limb - his left foot."
Crimes and Misdemeanors,https://firebasestorage.googleapis.com:443/v0/b/movie-mate-4ef5c.firebasestorage.app/o/movieImage%2F8187A149-90E0-4306-9C8A-560777703339.jpg?alt=media&token=b2688aad-e288-4838-b694-e55c6f683bbb,1989,104 min,"Comedy, Drama",7.9,Woody Allen,Martin Landau Woody Allen Bill Bernstein Claire Bloom,An ophthalmologist's mistress threatens to reveal their affair to his wife while a married documentary filmmaker is infatuated with another woman.
The Untouchables,https://firebasestorage.googleapis.com:443/v0/b/movie-mate-4ef5c.firebasestorage.app/o/movieImage%2F8187A149-90E0-4306-9C8A-560777703339.jpg?alt=media&token=b2688aad-e288-4838-b694-e55c6f683bbb,1987,119 min,"Crime, Drama, Thriller",7.9,Brian De Palma,Kevin Costner Sean Connery Robert De Niro Charles Martin Smith,"During the era of Prohibition in the United States, Federal Agent Eliot Ness sets out to stop ruthless Chicago gangster Al Capone and, because of rampant corruption, assembles a small, hand-picked team to help him."
Hannah and Her Sisters,https://firebasestorage.googleapis.com:443/v0/b/movie-mate-4ef5c.firebasestorage.app/o/movieImage%2F8187A149-90E0-4306-9C8A-560777703339.jpg?alt=media&token=b2688aad-e288-4838-b694-e55c6f683bbb,1986,107 min,"Comedy, Drama",7.9,Woody Allen,Mia Farrow Dianne Wiest Michael Caine Barbara Hershey,"Between two Thanksgivings two years apart, Hannah's husband falls in love with her sister Lee, while her hypochondriac ex-husband rekindles his relationship with her sister Holly."
Brazil,https://firebasestorage.googleapis.com:443/v0/b/movie-mate-4ef5c.firebasestorage.app/o/movieImage%2F8187A149-90E0-4306-9C8A-560777703339.jpg?alt=media&token=b2688aad-e288-4838-b694-e55c6f683bbb,1985,132 min,"Drama, Sci-Fi",7.9,Terry Gilliam,Jonathan Pryce Kim Greist Robert De Niro Katherine Helmond,A bureaucrat in a dystopic society becomes an enemy of the state as he pursues the woman of his dreams.
This Is Spinal Tap,https://firebasestorage.googleapis.com:443/v0/b/movie-mate-4ef5c.firebasestorage.app/o/movieImage%2F8187A149-90E0-4306-9C8A-560777703339.jpg?alt=media&token=b2688aad-e288-4838-b694-e55c6f683bbb,1984,82 min,"Comedy, Music",7.9,Rob Reiner,Rob Reiner Michael McKean Christopher Guest Kimberly Stringer,"Spinal Tap, one of England's loudest bands, is chronicled by film director Marty DiBergi on what proves to be a fateful tour."
A Christmas Story,https://firebasestorage.googleapis.com:443/v0/b/movie-mate-4ef5c.firebasestorage.app/o/movieImage%2F8187A149-90E0-4306-9C8A-560777703339.jpg?alt=media&token=b2688aad-e288-4838-b694-e55c6f683bbb,1983,93 min,"Comedy, Family",7.9,Bob Clark,Peter Billingsley Melinda Dillon Darren McGavin Scott Schwartz,"In the 1940s, a young boy named Ralphie attempts to convince his parents, his teacher and Santa that a Red Ryder BB gun really is the perfect Christmas gift."
The Blues Brothers,https://firebasestorage.googleapis.com:443/v0/b/movie-mate-4ef5c.firebasestorage.app/o/movieImage%2F8187A149-90E0-4306-9C8A-560777703339.jpg?alt=media&token=b2688aad-e288-4838-b694-e55c6f683bbb,1980,133 min,"Action, Adventure, Comedy",7.9,John Landis,John Belushi Dan Aykroyd Cab Calloway John Candy,"Jake Blues, just released from prison, puts together his old band to save the Catholic home where he and his brother Elwood were raised."
Manhattan,https://firebasestorage.googleapis.com:443/v0/b/movie-mate-4ef5c.firebasestorage.app/o/movieImage%2F8187A149-90E0-4306-9C8A-560777703339.jpg?alt=media&token=b2688aad-e288-4838-b694-e55c6f683bbb,1979,96 min,"Comedy, Drama, Romance",7.9,Woody Allen,Woody Allen Diane Keaton Mariel Hemingway Michael Murphy,The life of a divorced television writer dating a teenage girl is further complicated when he falls in love with his best friend's mistress.
All That Jazz,https://firebasestorage.googleapis.com:443/v0/b/movie-mate-4ef5c.firebasestorage.app/o/movieImage%2F8187A149-90E0-4306-9C8A-560777703339.jpg?alt=media&token=b2688aad-e288-4838-b694-e55c6f683bbb,1979,123 min,"Drama, Music, Musical",7.9,Bob Fosse,Roy Scheider Jessica Lange Ann Reinking Leland Palmer,"Director/choreographer Bob Fosse tells his own life story as he details the sordid career of Joe Gideon, a womanizing, drug-using dancer."
Dawn of the Dead,https://firebasestorage.googleapis.com:443/v0/b/movie-mate-4ef5c.firebasestorage.app/o/movieImage%2F8187A149-90E0-4306-9C8A-560777703339.jpg?alt=media&token=b2688aad-e288-4838-b694-e55c6f683bbb,1978,127 min,"Action, Adventure, Horror",7.9,George A. Romero,David Emge Ken Foree Scott H. Reiniger Gaylen Ross,"Following an ever-growing epidemic of zombies that have risen from the dead, two Philadelphia S.W.A.T. team members, a traffic reporter, and his television executive girlfriend seek refuge in a secluded shopping mall."
All the President's Men,https://firebasestorage.googleapis.com:443/v0/b/movie-mate-4ef5c.firebasestorage.app/o/movieImage%2F8187A149-90E0-4306-9C8A-560777703339.jpg?alt=media&token=b2688aad-e288-4838-b694-e55c6f683bbb,1976,138 min,"Biography, Drama, History",7.9,Alan J. Pakula,Dustin Hoffman Robert Redford Jack Warden Martin Balsam,"""The Washington Post"" reporters Bob Woodward and Carl Bernstein uncover the details of the Watergate scandal that leads to President Richard Nixon's resignation."
La montaña sagrada,https://firebasestorage.googleapis.com:443/v0/b/movie-mate-4ef5c.firebasestorage.app/o/movieImage%2F8187A149-90E0-4306-9C8A-560777703339.jpg?alt=media&token=b2688aad-e288-4838-b694-e55c6f683bbb,1973,114 min,"Adventure, Drama, Fantasy",7.9,Alejandro Jodorowsky,Alejandro Jodorowsky Horacio Salinas Zamira Saunders Juan Ferrara,"In a corrupt, greed-fueled world, a powerful alchemist leads a messianic character and seven materialistic figures to the Holy Mountain, where they hope to achieve enlightenment."
Amarcord,https://firebasestorage.googleapis.com:443/v0/b/movie-mate-4ef5c.firebasestorage.app/o/movieImage%2F8187A149-90E0-4306-9C8A-560777703339.jpg?alt=media&token=b2688aad-e288-4838-b694-e55c6f683bbb,1973,123 min,"Comedy, Drama, Family",7.9,Federico Fellini,Magali Noël Bruno Zanin Pupella Maggio Armando Brancia,A series of comedic and nostalgic vignettes set in a 1930s Italian coastal town.
Le charme discret de la bourgeoisie,https://firebasestorage.googleapis.com:443/v0/b/movie-mate-4ef5c.firebasestorage.app/o/movieImage%2F8187A149-90E0-4306-9C8A-560777703339.jpg?alt=media&token=b2688aad-e288-4838-b694-e55c6f683bbb,1972,102 min,Comedy,7.9,Luis Buñuel,Fernando Rey Delphine Seyrig Paul Frankeur Bulle Ogier,"A surreal, virtually plotless series of dreams centered around six middle-class people and their consistently interrupted attempts to have a meal together."
"Aguirre, der Zorn Gottes",https://firebasestorage.googleapis.com:443/v0/b/movie-mate-4ef5c.firebasestorage.app/o/movieImage%2F8187A149-90E0-4306-9C8A-560777703339.jpg?alt=media&token=b2688aad-e288-4838-b694-e55c6f683bbb,1972,95 min,"Action, Adventure, Biography",7.9,Werner Herzog,Klaus Kinski Ruy Guerra Helena Rojo Del Negro,"In the 16th century, the ruthless and insane Don Lope de Aguirre leads a Spanish expedition in search of El Dorado."
Harold and Maude,https://firebasestorage.googleapis.com:443/v0/b/movie-mate-4ef5c.firebasestorage.app/o/movieImage%2F8187A149-90E0-4306-9C8A-560777703339.jpg?alt=media&token=b2688aad-e288-4838-b694-e55c6f683bbb,1971,91 min,"Comedy, Drama, Romance",7.9,Hal Ashby,Ruth Gordon Bud Cort Vivian Pickles Cyril Cusack,"Young, rich, and obsessed with death, Harold finds himself changed forever when he meets lively septuagenarian Maude at a funeral."
Patton,https://firebasestorage.googleapis.com:443/v0/b/movie-mate-4ef5c.firebasestorage.app/o/movieImage%2F8187A149-90E0-4306-9C8A-560777703339.jpg?alt=media&token=b2688aad-e288-4838-b694-e55c6f683bbb,1970,172 min,"Biography, Drama, War",7.9,Franklin J. Schaffner,George C. Scott Karl Malden Stephen Young Michael Strong,The World War II phase of the career of controversial American general George S. Patton.
The Wild Bunch,https://firebasestorage.googleapis.com:443/v0/b/movie-mate-4ef5c.firebasestorage.app/o/movieImage%2F8187A149-90E0-4306-9C8A-560777703339.jpg?alt=media&token=b2688aad-e288-4838-b694-e55c6f683bbb,1969,145 min,"Action, Adventure, Western",7.9,Sam Peckinpah,William Holden Ernest Borgnine Robert Ryan Edmond O'Brien,"An aging group of outlaws look for one last big score as the ""traditional"" American West is disappearing around them."
Night of the Living Dead,https://firebasestorage.googleapis.com:443/v0/b/movie-mate-4ef5c.firebasestorage.app/o/movieImage%2F8187A149-90E0-4306-9C8A-560777703339.jpg?alt=media&token=b2688aad-e288-4838-b694-e55c6f683bbb,1968,96 min,"Horror, Thriller",7.9,George A. Romero,Duane Jones Judith O'Dea Karl Hardman Marilyn Eastman,A ragtag group of Pennsylvanians barricade themselves in an old farmhouse to remain safe from a horde of flesh-eating ghouls that are ravaging the East Coast of the United States.
The Lion in Winter,https://firebasestorage.googleapis.com:443/v0/b/movie-mate-4ef5c.firebasestorage.app/o/movieImage%2F8187A149-90E0-4306-9C8A-560777703339.jpg?alt=media&token=b2688aad-e288-4838-b694-e55c6f683bbb,1968,134 min,"Biography, Drama, History",7.9,Anthony Harvey,Peter O'Toole Katharine Hepburn Anthony Hopkins John Castle,"1183 A.D.: King Henry II's three sons all want to inherit the throne, but he won't commit to a choice. They and his wife variously plot to force him."
In the Heat of the Night,https://firebasestorage.googleapis.com:443/v0/b/movie-mate-4ef5c.firebasestorage.app/o/movieImage%2F8187A149-90E0-4306-9C8A-560777703339.jpg?alt=media&token=b2688aad-e288-4838-b694-e55c6f683bbb,1967,110 min,"Crime, Drama, Mystery",7.9,Norman Jewison,Sidney Poitier Rod Steiger Warren Oates Lee Grant,A black police detective is asked to investigate a murder in a racially hostile southern town.
