name,image,year,runTime,genre,rating,director,stars,description
This Is England,https://firebasestorage.googleapis.com:443/v0/b/movie-mate-4ef5c.firebasestorage.app/o/movieImage%2F8187A149-90E0-4306-9C8A-560777703339.jpg?alt=media&token=b2688aad-e288-4838-b694-e55c6f683bbb,2006,101 min,"Crime, Drama",7.7,Shane Meadows,Thomas Turgoose Stephen Graham Jo Hartley Andrew Shim,"A young boy becomes friends with a gang of skinheads. Friends soon become like family, and relationships will be pushed to the very limit."
Ex Machina,https://firebasestorage.googleapis.com:443/v0/b/movie-mate-4ef5c.firebasestorage.app/o/movieImage%2F8187A149-90E0-4306-9C8A-560777703339.jpg?alt=media&token=b2688aad-e288-4838-b694-e55c6f683bbb,2014,108 min,"Drama, Sci-Fi, Thriller",7.7,Alex Garland,Alicia Vikander Domhnall Gleeson Oscar Isaac Sonoya Mizuno,A young programmer is selected to participate in a ground-breaking experiment in synthetic intelligence by evaluating the human qualities of a highly advanced humanoid A.I.
Efter brylluppet,https://firebasestorage.googleapis.com:443/v0/b/movie-mate-4ef5c.firebasestorage.app/o/movieImage%2F8187A149-90E0-4306-9C8A-560777703339.jpg?alt=media&token=b2688aad-e288-4838-b694-e55c6f683bbb,2006,120 min,Drama,7.7,Susanne Bier,Mads Mikkelsen Sidse Babett Knudsen Rolf Lassgård Neeral Mulchandani,"A manager of an orphanage in India is sent to Copenhagen, Denmark, where he discovers a life-altering family secret."
The Last King of Scotland,https://firebasestorage.googleapis.com:443/v0/b/movie-mate-4ef5c.firebasestorage.app/o/movieImage%2F8187A149-90E0-4306-9C8A-560777703339.jpg?alt=media&token=b2688aad-e288-4838-b694-e55c6f683bbb,2006,123 min,"Biography, Drama, History",7.7,Kevin Macdonald,James McAvoy Forest Whitaker Gillian Anderson Kerry Washington,Based on the events of the brutal Ugandan dictator Idi Amin's regime as seen by his personal physician during the 1970s.
Zodiac,https://firebasestorage.googleapis.com:443/v0/b/movie-mate-4ef5c.firebasestorage.app/o/movieImage%2F8187A149-90E0-4306-9C8A-560777703339.jpg?alt=media&token=b2688aad-e288-4838-b694-e55c6f683bbb,2007,157 min,"Crime, Drama, Mystery",7.7,David Fincher,Jake Gyllenhaal Robert Downey Jr. Mark Ruffalo Anthony Edwards,"In the late 1960s/early 1970s, a San Francisco cartoonist becomes an amateur detective obsessed with tracking down the Zodiac Killer, an unidentified individual who terrorizes Northern California with a killing spree."
Lucky Number Slevin,https://firebasestorage.googleapis.com:443/v0/b/movie-mate-4ef5c.firebasestorage.app/o/movieImage%2F8187A149-90E0-4306-9C8A-560777703339.jpg?alt=media&token=b2688aad-e288-4838-b694-e55c6f683bbb,2006,110 min,"Action, Crime, Drama",7.7,Paul McGuigan,Josh Hartnett Ben Kingsley Morgan Freeman Lucy Liu,"A case of mistaken identity lands Slevin into the middle of a war being plotted by two of the city's most rival crime bosses. Under constant surveillance by Detective Brikowski and assassin Goodkat, he must get them before they get him."
Joyeux Noël,https://firebasestorage.googleapis.com:443/v0/b/movie-mate-4ef5c.firebasestorage.app/o/movieImage%2F8187A149-90E0-4306-9C8A-560777703339.jpg?alt=media&token=b2688aad-e288-4838-b694-e55c6f683bbb,2005,116 min,"Drama, History, Music",7.7,Christian Carion,Diane Kruger Benno Fürmann Guillaume Canet Natalie Dessay,"In December 1914, an unofficial Christmas truce on the Western Front allows soldiers from opposing sides of the First World War to gain insight into each other's way of life."
Control,https://firebasestorage.googleapis.com:443/v0/b/movie-mate-4ef5c.firebasestorage.app/o/movieImage%2F8187A149-90E0-4306-9C8A-560777703339.jpg?alt=media&token=b2688aad-e288-4838-b694-e55c6f683bbb,2007,122 min,"Biography, Drama, Music",7.7,Anton Corbijn,Sam Riley Samantha Morton Craig Parkinson Alexandra Maria Lara,"A profile of Ian Curtis, the enigmatic singer of Joy Division whose personal, professional, and romantic troubles led him to commit suicide at the age of 23."
Tangled,https://firebasestorage.googleapis.com:443/v0/b/movie-mate-4ef5c.firebasestorage.app/o/movieImage%2F8187A149-90E0-4306-9C8A-560777703339.jpg?alt=media&token=b2688aad-e288-4838-b694-e55c6f683bbb,2010,100 min,"Animation, Adventure, Comedy",7.7,Nathan Greno,Byron Howard Mandy Moore Zachary Levi Donna Murphy,"The magically long-haired Rapunzel has spent her entire life in a tower, but now that a runaway thief has stumbled upon her, she is about to discover the world for the first time, and who she really is."
Zwartboek,https://firebasestorage.googleapis.com:443/v0/b/movie-mate-4ef5c.firebasestorage.app/o/movieImage%2F8187A149-90E0-4306-9C8A-560777703339.jpg?alt=media&token=b2688aad-e288-4838-b694-e55c6f683bbb,2006,145 min,"Drama, Thriller, War",7.7,Paul Verhoeven,Carice van Houten Sebastian Koch Thom Hoffman Halina Reijn,"In the Nazi-occupied Netherlands during World War II, a Jewish singer infiltrates the regional Gestapo headquarters for the Dutch resistance."
Brokeback Mountain,https://firebasestorage.googleapis.com:443/v0/b/movie-mate-4ef5c.firebasestorage.app/o/movieImage%2F8187A149-90E0-4306-9C8A-560777703339.jpg?alt=media&token=b2688aad-e288-4838-b694-e55c6f683bbb,2005,134 min,"Drama, Romance",7.7,Ang Lee,Jake Gyllenhaal Heath Ledger Michelle Williams Randy Quaid,"The story of a forbidden and secretive relationship between two cowboys, and their lives over the years."
3:10 to Yuma,https://firebasestorage.googleapis.com:443/v0/b/movie-mate-4ef5c.firebasestorage.app/o/movieImage%2F8187A149-90E0-4306-9C8A-560777703339.jpg?alt=media&token=b2688aad-e288-4838-b694-e55c6f683bbb,2007,122 min,"Action, Crime, Drama",7.7,James Mangold,Russell Crowe Christian Bale Ben Foster Logan Lerman,A small-time rancher agrees to hold a captured outlaw who's awaiting a train to go to court in Yuma. A battle of wills ensues as the outlaw tries to psych out the rancher.
Crash,https://firebasestorage.googleapis.com:443/v0/b/movie-mate-4ef5c.firebasestorage.app/o/movieImage%2F8187A149-90E0-4306-9C8A-560777703339.jpg?alt=media&token=b2688aad-e288-4838-b694-e55c6f683bbb,2004,112 min,"Crime, Drama, Thriller",7.7,Paul Haggis,Don Cheadle Sandra Bullock Thandie Newton Karina Arroyave,"Los Angeles citizens with vastly separate lives collide in interweaving stories of race, loss and redemption."
Kung fu,https://firebasestorage.googleapis.com:443/v0/b/movie-mate-4ef5c.firebasestorage.app/o/movieImage%2F8187A149-90E0-4306-9C8A-560777703339.jpg?alt=media&token=b2688aad-e288-4838-b694-e55c6f683bbb,2004,99 min,"Action, Comedy, Fantasy",7.7,Stephen Chow,Stephen Chow Wah Yuen Qiu Yuen Siu-Lung Leung,"In Shanghai, China in the 1940s, a wannabe gangster aspires to join the notorious ""Axe Gang"" while residents of a housing complex exhibit extraordinary powers in defending their turf."
The Bourne Supremacy,https://firebasestorage.googleapis.com:443/v0/b/movie-mate-4ef5c.firebasestorage.app/o/movieImage%2F8187A149-90E0-4306-9C8A-560777703339.jpg?alt=media&token=b2688aad-e288-4838-b694-e55c6f683bbb,2004,108 min,"Action, Mystery, Thriller",7.7,Paul Greengrass,Matt Damon Franka Potente Joan Allen Brian Cox,"When Jason Bourne is framed for a CIA operation gone awry, he is forced to resume his former life as a trained assassin to survive."
The Machinist,https://firebasestorage.googleapis.com:443/v0/b/movie-mate-4ef5c.firebasestorage.app/o/movieImage%2F8187A149-90E0-4306-9C8A-560777703339.jpg?alt=media&token=b2688aad-e288-4838-b694-e55c6f683bbb,2004,101 min,"Drama, Thriller",7.7,Brad Anderson,Christian Bale Jennifer Jason Leigh Aitana Sánchez-Gijón John Sharian,An industrial worker who hasn't slept in a year begins to doubt his own sanity.
Ray,https://firebasestorage.googleapis.com:443/v0/b/movie-mate-4ef5c.firebasestorage.app/o/movieImage%2F8187A149-90E0-4306-9C8A-560777703339.jpg?alt=media&token=b2688aad-e288-4838-b694-e55c6f683bbb,2004,152 min,"Biography, Drama, Music",7.7,Taylor Hackford,Jamie Foxx Regina King Kerry Washington Clifton Powell,"The story of the life and career of the legendary rhythm and blues musician Ray Charles, from his humble beginnings in the South, where he went blind at age seven, to his meteoric rise to stardom during the 1950s and 1960s."
Lost in Translation,https://firebasestorage.googleapis.com:443/v0/b/movie-mate-4ef5c.firebasestorage.app/o/movieImage%2F8187A149-90E0-4306-9C8A-560777703339.jpg?alt=media&token=b2688aad-e288-4838-b694-e55c6f683bbb,2003,102 min,"Comedy, Drama",7.7,Sofia Coppola,Bill Murray Scarlett Johansson Giovanni Ribisi Anna Faris,A faded movie star and a neglected young woman form an unlikely bond after crossing paths in Tokyo.
Harry Potter and the Goblet of Fire,https://firebasestorage.googleapis.com:443/v0/b/movie-mate-4ef5c.firebasestorage.app/o/movieImage%2F8187A149-90E0-4306-9C8A-560777703339.jpg?alt=media&token=b2688aad-e288-4838-b694-e55c6f683bbb,2005,157 min,"Adventure, Family, Fantasy",7.7,Mike Newell,Daniel Radcliffe Emma Watson Rupert Grint Eric Sykes,"Harry Potter finds himself competing in a hazardous tournament between rival schools of magic, but he is distracted by recurring nightmares."
Man on Fire,https://firebasestorage.googleapis.com:443/v0/b/movie-mate-4ef5c.firebasestorage.app/o/movieImage%2F8187A149-90E0-4306-9C8A-560777703339.jpg?alt=media&token=b2688aad-e288-4838-b694-e55c6f683bbb,2004,146 min,"Action, Crime, Drama",7.7,Tony Scott,Denzel Washington Christopher Walken Dakota Fanning Radha Mitchell,"In Mexico City, a former CIA operative swears vengeance on those who committed an unspeakable act against the family he was hired to protect."
Coraline,https://firebasestorage.googleapis.com:443/v0/b/movie-mate-4ef5c.firebasestorage.app/o/movieImage%2F8187A149-90E0-4306-9C8A-560777703339.jpg?alt=media&token=b2688aad-e288-4838-b694-e55c6f683bbb,2009,100 min,"Animation, Drama, Family",7.7,Henry Selick,Dakota Fanning Teri Hatcher John Hodgman Jennifer Saunders,"An adventurous 11-year-old girl finds another world that is a strangely idealized version of her frustrating home, but it has sinister secrets."
The Last Samurai,https://firebasestorage.googleapis.com:443/v0/b/movie-mate-4ef5c.firebasestorage.app/o/movieImage%2F8187A149-90E0-4306-9C8A-560777703339.jpg?alt=media&token=b2688aad-e288-4838-b694-e55c6f683bbb,2003,154 min,"Action, Drama",7.7,Edward Zwick,Tom Cruise Ken Watanabe Billy Connolly William Atherton,An American military advisor embraces the Samurai culture he was hired to destroy after he is captured in battle.
The Magdalene Sisters,https://firebasestorage.googleapis.com:443/v0/b/movie-mate-4ef5c.firebasestorage.app/o/movieImage%2F8187A149-90E0-4306-9C8A-560777703339.jpg?alt=media&token=b2688aad-e288-4838-b694-e55c6f683bbb,2002,114 min,Drama,7.7,Peter Mullan,Eileen Walsh Dorothy Duffy Nora-Jane Noone Anne-Marie Duff,Three young Irish women struggle to maintain their spirits while they endure dehumanizing abuse as inmates of a Magdalene Sisters Asylum.
Good Bye Lenin!,https://firebasestorage.googleapis.com:443/v0/b/movie-mate-4ef5c.firebasestorage.app/o/movieImage%2F8187A149-90E0-4306-9C8A-560777703339.jpg?alt=media&token=b2688aad-e288-4838-b694-e55c6f683bbb,2003,121 min,"Comedy, Drama, Romance",7.7,Wolfgang Becker,Daniel Brühl Katrin Saß Chulpan Khamatova Florian Lukas,"In 1990, to protect his fragile mother from a fatal shock after a long coma, a young man must keep her from learning that her beloved nation of East Germany as she knew it has disappeared."
In America,https://firebasestorage.googleapis.com:443/v0/b/movie-mate-4ef5c.firebasestorage.app/o/movieImage%2F8187A149-90E0-4306-9C8A-560777703339.jpg?alt=media&token=b2688aad-e288-4838-b694-e55c6f683bbb,2002,105 min,Drama,7.7,Jim Sheridan,Paddy Considine Samantha Morton Djimon Hounsou Sarah Bolger,A family of Irish immigrants adjust to life on the mean streets of Hell's Kitchen while also grieving the death of a child.
I Am Sam,https://firebasestorage.googleapis.com:443/v0/b/movie-mate-4ef5c.firebasestorage.app/o/movieImage%2F8187A149-90E0-4306-9C8A-560777703339.jpg?alt=media&token=b2688aad-e288-4838-b694-e55c6f683bbb,2001,132 min,Drama,7.7,Jessie Nelson,Sean Penn Michelle Pfeiffer Dakota Fanning Dianne Wiest,A mentally handicapped man fights for custody of his 7-year-old daughter and in the process teaches his cold-hearted lawyer the value of love and family.
Adaptation.,https://firebasestorage.googleapis.com:443/v0/b/movie-mate-4ef5c.firebasestorage.app/o/movieImage%2F8187A149-90E0-4306-9C8A-560777703339.jpg?alt=media&token=b2688aad-e288-4838-b694-e55c6f683bbb,2002,115 min,"Comedy, Drama",7.7,Spike Jonze,Nicolas Cage Meryl Streep Chris Cooper Tilda Swinton,A lovelorn screenwriter becomes desperate as he tries and fails to adapt 'The Orchid Thief' by Susan Orlean for the screen.
Black Hawk Down,https://firebasestorage.googleapis.com:443/v0/b/movie-mate-4ef5c.firebasestorage.app/o/movieImage%2F8187A149-90E0-4306-9C8A-560777703339.jpg?alt=media&token=b2688aad-e288-4838-b694-e55c6f683bbb,2001,144 min,"Drama, History, War",7.7,Ridley Scott,Josh Hartnett Ewan McGregor Tom Sizemore Eric Bana,160 elite U.S. soldiers drop into Somalia to capture two top lieutenants of a renegade warlord and find themselves in a desperate battle with a large force of heavily-armed Somalis.
Road to Perdition,https://firebasestorage.googleapis.com:443/v0/b/movie-mate-4ef5c.firebasestorage.app/o/movieImage%2F8187A149-90E0-4306-9C8A-560777703339.jpg?alt=media&token=b2688aad-e288-4838-b694-e55c6f683bbb,2002,117 min,"Crime, Drama, Thriller",7.7,Sam Mendes,Tom Hanks Tyler Hoechlin Rob Maxey Liam Aiken,"A mob enforcer's son witnesses a murder, forcing him and his father to take to the road, and his father down a path of redemption and revenge."
Das Experiment,https://firebasestorage.googleapis.com:443/v0/b/movie-mate-4ef5c.firebasestorage.app/o/movieImage%2F8187A149-90E0-4306-9C8A-560777703339.jpg?alt=media&token=b2688aad-e288-4838-b694-e55c6f683bbb,2001,120 min,"Drama, Thriller",7.7,Oliver Hirschbiegel,Moritz Bleibtreu Christian Berkel Oliver Stokowski Wotan Wilke Möhring,"For two weeks, 20 male participants are hired to play prisoners and guards in a prison. The ""prisoners"" have to follow seemingly mild rules, and the ""guards"" are told to retain order without using physical violence."
Billy Elliot,https://firebasestorage.googleapis.com:443/v0/b/movie-mate-4ef5c.firebasestorage.app/o/movieImage%2F8187A149-90E0-4306-9C8A-560777703339.jpg?alt=media&token=b2688aad-e288-4838-b694-e55c6f683bbb,2000,110 min,"Drama, Music",7.7,Stephen Daldry,Jamie Bell Julie Walters Jean Heywood Jamie Draven,A talented young boy becomes torn between his unexpected love of dance and the disintegration of his family.
Hedwig and the Angry Inch,https://firebasestorage.googleapis.com:443/v0/b/movie-mate-4ef5c.firebasestorage.app/o/movieImage%2F8187A149-90E0-4306-9C8A-560777703339.jpg?alt=media&token=b2688aad-e288-4838-b694-e55c6f683bbb,2001,95 min,"Comedy, Drama, Music",7.7,John Cameron Mitchell,John Cameron Mitchell Miriam Shor Stephen Trask Theodore Liscinski,A gender-queer punk-rock singer from East Berlin tours the U.S. with her band as she tells her life story and follows the former lover/band-mate who stole her songs.
Ocean's Eleven,https://firebasestorage.googleapis.com:443/v0/b/movie-mate-4ef5c.firebasestorage.app/o/movieImage%2F8187A149-90E0-4306-9C8A-560777703339.jpg?alt=media&token=b2688aad-e288-4838-b694-e55c6f683bbb,2001,116 min,"Crime, Thriller",7.7,Steven Soderbergh,George Clooney Brad Pitt Julia Roberts Matt Damon,Danny Ocean and his ten accomplices plan to rob three Las Vegas casinos simultaneously.
Vampire Hunter D: Bloodlust,https://firebasestorage.googleapis.com:443/v0/b/movie-mate-4ef5c.firebasestorage.app/o/movieImage%2F8187A149-90E0-4306-9C8A-560777703339.jpg?alt=media&token=b2688aad-e288-4838-b694-e55c6f683bbb,2000,103 min,"Animation, Action, Fantasy",7.7,Yoshiaki Kawajiri,Andrew Philpot John Rafter Lee Pamela Adlon Wendee Lee,"When a girl is abducted by a vampire, a legendary bounty hunter is hired to bring her back."
"O Brother, Where Art Thou?",https://firebasestorage.googleapis.com:443/v0/b/movie-mate-4ef5c.firebasestorage.app/o/movieImage%2F8187A149-90E0-4306-9C8A-560777703339.jpg?alt=media&token=b2688aad-e288-4838-b694-e55c6f683bbb,2000,107 min,"Adventure, Comedy, Crime",7.7,Joel Coen,Ethan Coen George Clooney John Turturro Tim Blake Nelson,"In the deep south during the 1930s, three escaped convicts search for hidden treasure while a relentless lawman pursues them."
Interstate 60: Episodes of the Road,https://firebasestorage.googleapis.com:443/v0/b/movie-mate-4ef5c.firebasestorage.app/o/movieImage%2F8187A149-90E0-4306-9C8A-560777703339.jpg?alt=media&token=b2688aad-e288-4838-b694-e55c6f683bbb,2002,116 min,"Adventure, Comedy, Drama",7.7,Bob Gale,James Marsden Gary Oldman Kurt Russell Matthew Edison,"Neal Oliver, a very confused young man and an artist, takes a journey of a lifetime on a highway I60 that doesn't exist on any of the maps, going to the places he never even heard of, searching for an answer and his dreamgirl."
"South Park: Bigger, Longer & Uncut",https://firebasestorage.googleapis.com:443/v0/b/movie-mate-4ef5c.firebasestorage.app/o/movieImage%2F8187A149-90E0-4306-9C8A-560777703339.jpg?alt=media&token=b2688aad-e288-4838-b694-e55c6f683bbb,1999,81 min,"Animation, Comedy, Fantasy",7.7,Trey Parker,Trey Parker Matt Stone Mary Kay Bergman Isaac Hayes,"When Stan Marsh and his friends go see an R-rated movie, they start cursing and their parents think that Canada is to blame."
Office Space,https://firebasestorage.googleapis.com:443/v0/b/movie-mate-4ef5c.firebasestorage.app/o/movieImage%2F8187A149-90E0-4306-9C8A-560777703339.jpg?alt=media&token=b2688aad-e288-4838-b694-e55c6f683bbb,1999,89 min,Comedy,7.7,Mike Judge,Ron Livingston Jennifer Aniston David Herman Ajay Naidu,Three company workers who hate their jobs decide to rebel against their greedy boss.
Happiness,https://firebasestorage.googleapis.com:443/v0/b/movie-mate-4ef5c.firebasestorage.app/o/movieImage%2F8187A149-90E0-4306-9C8A-560777703339.jpg?alt=media&token=b2688aad-e288-4838-b694-e55c6f683bbb,1998,134 min,"Comedy, Drama",7.7,Todd Solondz,Jane Adams Jon Lovitz Philip Seymour Hoffman Dylan Baker,"The lives of several individuals intertwine as they go about their lives in their own unique ways, engaging in acts society as a whole might find disturbing in a desperate search for human connection."
Training Day,https://firebasestorage.googleapis.com:443/v0/b/movie-mate-4ef5c.firebasestorage.app/o/movieImage%2F8187A149-90E0-4306-9C8A-560777703339.jpg?alt=media&token=b2688aad-e288-4838-b694-e55c6f683bbb,2001,122 min,"Crime, Drama, Thriller",7.7,Antoine Fuqua,Denzel Washington Ethan Hawke Scott Glenn Tom Berenger,A rookie cop spends his first day as a Los Angeles narcotics officer with a rogue detective who isn't what he appears to be.
Rushmore,https://firebasestorage.googleapis.com:443/v0/b/movie-mate-4ef5c.firebasestorage.app/o/movieImage%2F8187A149-90E0-4306-9C8A-560777703339.jpg?alt=media&token=b2688aad-e288-4838-b694-e55c6f683bbb,1998,93 min,"Comedy, Drama, Romance",7.7,Wes Anderson,Jason Schwartzman Bill Murray Olivia Williams Seymour Cassel,The extracurricular king of Rushmore Preparatory School is put on academic probation.
Abre los ojos,https://firebasestorage.googleapis.com:443/v0/b/movie-mate-4ef5c.firebasestorage.app/o/movieImage%2F8187A149-90E0-4306-9C8A-560777703339.jpg?alt=media&token=b2688aad-e288-4838-b694-e55c6f683bbb,1997,119 min,"Drama, Mystery, Sci-Fi",7.7,Alejandro Amenábar,Eduardo Noriega Penélope Cruz Chete Lera Fele Martínez,"A very handsome man finds the love of his life, but he suffers an accident and needs to have his face rebuilt by surgery after it is severely disfigured."
Being John Malkovich,https://firebasestorage.googleapis.com:443/v0/b/movie-mate-4ef5c.firebasestorage.app/o/movieImage%2F8187A149-90E0-4306-9C8A-560777703339.jpg?alt=media&token=b2688aad-e288-4838-b694-e55c6f683bbb,1999,113 min,"Comedy, Drama, Fantasy",7.7,Spike Jonze,John Cusack Cameron Diaz Catherine Keener John Malkovich,A puppeteer discovers a portal that leads literally into the head of movie star John Malkovich.
As Good as It Gets,https://firebasestorage.googleapis.com:443/v0/b/movie-mate-4ef5c.firebasestorage.app/o/movieImage%2F8187A149-90E0-4306-9C8A-560777703339.jpg?alt=media&token=b2688aad-e288-4838-b694-e55c6f683bbb,1997,139 min,"Comedy, Drama, Romance",7.7,James L. Brooks,Jack Nicholson Helen Hunt Greg Kinnear Cuba Gooding Jr.,"A single mother and waitress, a misanthropic author, and a gay artist form an unlikely friendship after the artist is assaulted in a robbery."
The Fifth Element,https://firebasestorage.googleapis.com:443/v0/b/movie-mate-4ef5c.firebasestorage.app/o/movieImage%2F8187A149-90E0-4306-9C8A-560777703339.jpg?alt=media&token=b2688aad-e288-4838-b694-e55c6f683bbb,1997,126 min,"Action, Adventure, Sci-Fi",7.7,Luc Besson,Bruce Willis Milla Jovovich Gary Oldman Ian Holm,"In the colorful future, a cab driver unwittingly becomes the central figure in the search for a legendary cosmic weapon to keep Evil and Mr. Zorg at bay."
Le dîner de cons,https://firebasestorage.googleapis.com:443/v0/b/movie-mate-4ef5c.firebasestorage.app/o/movieImage%2F8187A149-90E0-4306-9C8A-560777703339.jpg?alt=media&token=b2688aad-e288-4838-b694-e55c6f683bbb,1998,80 min,Comedy,7.7,Francis Veber,Thierry Lhermitte Jacques Villeret Francis Huster Daniel Prévost,"A few friends have a weekly fools' dinner, where each brings a fool along. Pierre finds a champion fool for next dinner. Surprise."
Donnie Brasco,https://firebasestorage.googleapis.com:443/v0/b/movie-mate-4ef5c.firebasestorage.app/o/movieImage%2F8187A149-90E0-4306-9C8A-560777703339.jpg?alt=media&token=b2688aad-e288-4838-b694-e55c6f683bbb,1997,127 min,"Biography, Crime, Drama",7.7,Mike Newell,Al Pacino Johnny Depp Michael Madsen Bruno Kirby,"An FBI undercover agent infiltrates the mob and finds himself identifying more with the mafia life, at the expense of his regular one."
Shine,https://firebasestorage.googleapis.com:443/v0/b/movie-mate-4ef5c.firebasestorage.app/o/movieImage%2F8187A149-90E0-4306-9C8A-560777703339.jpg?alt=media&token=b2688aad-e288-4838-b694-e55c6f683bbb,1996,105 min,"Biography, Drama, Music",7.7,Scott Hicks,Geoffrey Rush Armin Mueller-Stahl Justin Braine Sonia Todd,"Pianist David Helfgott, driven by his father and teachers, has a breakdown. Years later he returns to the piano, to popular if not critical acclaim."
Primal Fear,https://firebasestorage.googleapis.com:443/v0/b/movie-mate-4ef5c.firebasestorage.app/o/movieImage%2F8187A149-90E0-4306-9C8A-560777703339.jpg?alt=media&token=b2688aad-e288-4838-b694-e55c6f683bbb,1996,129 min,"Crime, Drama, Mystery",7.7,Gregory Hoblit,Richard Gere Laura Linney Edward Norton John Mahoney,"An altar boy is accused of murdering a priest, and the truth is buried several layers deep."
Hamlet,https://firebasestorage.googleapis.com:443/v0/b/movie-mate-4ef5c.firebasestorage.app/o/movieImage%2F8187A149-90E0-4306-9C8A-560777703339.jpg?alt=media&token=b2688aad-e288-4838-b694-e55c6f683bbb,1996,242 min,Drama,7.7,Kenneth Branagh,Kenneth Branagh Julie Christie Derek Jacobi Kate Winslet,"Hamlet, Prince of Denmark, returns home to find his father murdered and his mother remarrying the murderer, his uncle. Meanwhile, war is brewing."
A Little Princess,https://firebasestorage.googleapis.com:443/v0/b/movie-mate-4ef5c.firebasestorage.app/o/movieImage%2F8187A149-90E0-4306-9C8A-560777703339.jpg?alt=media&token=b2688aad-e288-4838-b694-e55c6f683bbb,1995,97 min,"Drama, Family, Fantasy",7.7,Alfonso Cuarón,Liesel Matthews Eleanor Bron Liam Cunningham Rusty Schwimmer,A young girl is relegated to servitude at a boarding school when her father goes missing and is presumed dead.
Do lok tin si,https://firebasestorage.googleapis.com:443/v0/b/movie-mate-4ef5c.firebasestorage.app/o/movieImage%2F8187A149-90E0-4306-9C8A-560777703339.jpg?alt=media&token=b2688aad-e288-4838-b694-e55c6f683bbb,1995,99 min,"Comedy, Crime, Drama",7.7,Kar-Wai Wong,Leon Lai Michelle Reis Takeshi Kaneshiro Charlie Yeung,"This Hong Kong-set crime drama follows the lives of a hitman, hoping to get out of the business, and his elusive female partner."
Il postino,https://firebasestorage.googleapis.com:443/v0/b/movie-mate-4ef5c.firebasestorage.app/o/movieImage%2F8187A149-90E0-4306-9C8A-560777703339.jpg?alt=media&token=b2688aad-e288-4838-b694-e55c6f683bbb,1994,108 min,"Biography, Comedy, Drama",7.7,Michael Radford,Massimo Troisi Massimo Troisi Philippe Noiret Maria Grazia Cucinotta,"A simple Italian postman learns to love poetry while delivering mail to a famous poet, and then uses this to woo local beauty Beatrice."
Clerks,https://firebasestorage.googleapis.com:443/v0/b/movie-mate-4ef5c.firebasestorage.app/o/movieImage%2F8187A149-90E0-4306-9C8A-560777703339.jpg?alt=media&token=b2688aad-e288-4838-b694-e55c6f683bbb,1994,92 min,Comedy,7.7,Kevin Smith,Brian O'Halloran Jeff Anderson Marilyn Ghigliotti Lisa Spoonauer,"A day in the lives of two convenience clerks named Dante and Randal as they annoy customers, discuss movies, and play hockey on the store roof."
Short Cuts,https://firebasestorage.googleapis.com:443/v0/b/movie-mate-4ef5c.firebasestorage.app/o/movieImage%2F8187A149-90E0-4306-9C8A-560777703339.jpg?alt=media&token=b2688aad-e288-4838-b694-e55c6f683bbb,1993,188 min,"Comedy, Drama",7.7,Robert Altman,Andie MacDowell Julianne Moore Tim Robbins Bruce Davison,The day-to-day lives of several suburban Los Angeles residents.
Philadelphia,https://firebasestorage.googleapis.com:443/v0/b/movie-mate-4ef5c.firebasestorage.app/o/movieImage%2F8187A149-90E0-4306-9C8A-560777703339.jpg?alt=media&token=b2688aad-e288-4838-b694-e55c6f683bbb,1993,125 min,Drama,7.7,Jonathan Demme,Tom Hanks Denzel Washington Roberta Maxwell Buzz Kilman,"When a man with HIV is fired by his law firm because of his condition, he hires a homophobic small time lawyer as the only willing advocate for a wrongful dismissal suit."
